{
  "id": "G1-GC-004",
  "symptom_class": "tie",
  "description": "Synthetic fixture (no real professional, student, or event data). Ratified reproducing inputs for the G1-GC-001 exact-tie symptom: two candidates are symmetric on every Stage B factor input, so any weight vector over the approved factor set produces an exact tie. The tie-break rule sorts lexicographic-ascending by subject_id, exercised here by listing the candidates in reverse (SYNTH-PRO-0002 first) so the test proves the rank sorts rather than preserving input order. The legacy 43% tie value is deliberately NOT asserted anywhere in this fixture — characterizing the defective legacy engine is forbidden.",
  "registry_version": "1.1.1-approved-g1-m6j",
  "stakeholder_reference": "docs/plans/workshops/g1-workshop-output-worksheet.md agenda item 3 (RATIFIED 2026-09-03)",
  "inputs": {
    "candidates": [
      {
        "subject_id": "SYNTH-PRO-0002",
        "expertise_topics": ["artificial_intelligence", "machine_learning"],
        "coordinates": { "latitude": 34.1522, "longitude": -118.2437 }
      },
      {
        "subject_id": "SYNTH-PRO-0001",
        "expertise_topics": ["artificial_intelligence", "machine_learning"],
        "coordinates": { "latitude": 34.1522, "longitude": -118.2437 }
      }
    ],
    "event_need": {
      "required_topics": ["artificial_intelligence"],
      "preferred_topics": ["machine_learning"],
      "coordinates": { "latitude": 34.0522, "longitude": -118.2437 }
    }
  },
  "expected": {
    "factor_scores": {
      "topic_relevance": { "value": 1.0, "zero_classification": null },
      "travel_burden": { "value": 0.0, "zero_classification": "measured_zero" }
    },
    "unknown_factor_keys": [],
    "stage_b_score": 1.0,
    "scores_are_equal": true,
    "ranking": ["SYNTH-PRO-0001", "SYNTH-PRO-0002"]
  }
}
