{
  "id": "G1-GC-005",
  "symptom_class": "zero_or_unknown",
  "description": "Synthetic fixture (no real professional or event data). ADR-0011 discriminating case A for the G1-GC-002 symptom, ratified: the professional carries no expertise-topics record at all, so topic_relevance is not computable — genuinely unknown, not a measured zero. No legacy engine output is asserted anywhere in this fixture.",
  "registry_version": "1.1.1-approved-g1-m6j",
  "stakeholder_reference": "docs/plans/workshops/g1-workshop-output-worksheet.md agenda item 3 (RATIFIED 2026-09-03)",
  "zero_classification": "unknown",
  "inputs": {
    "candidate": {
      "subject_id": "SYNTH-PRO-0005"
    },
    "professional": {
      "expertise_topics": null,
      "coordinates": { "latitude": 34.0522, "longitude": -118.2437 }
    },
    "event_need": {
      "required_topics": ["artificial_intelligence"],
      "preferred_topics": [],
      "coordinates": { "latitude": 34.0522, "longitude": -118.2437 }
    }
  },
  "expected": {
    "factor_scores": {
      "topic_relevance": { "value": null, "zero_classification": "unknown" },
      "travel_burden": { "value": 0.0, "zero_classification": "measured_zero" }
    },
    "unknown_factor_keys": ["topic_relevance"],
    "stage_b_score": null
  }
}
