{
  "id": "G1-GC-006",
  "symptom_class": "zero_or_unknown",
  "description": "Synthetic fixture (no real professional or event data). ADR-0011 discriminating case B for the G1-GC-002 symptom, ratified: the professional's expertise topics are recorded and none overlap the event_need's required or preferred topics, so the zero here is a measured fact, not an absence. No predecessor-engine output is asserted anywhere in this fixture.",
  "registry_version": "1.1.1-approved-g1-m6j",
  "stakeholder_reference": "docs/plans/workshops/g1-workshop-output-worksheet.md agenda item 3 (RATIFIED 2026-09-03)",
  "zero_classification": "measured_zero",
  "inputs": {
    "candidate": {
      "subject_id": "SYNTH-PRO-0006"
    },
    "professional": {
      "expertise_topics": ["municipal_finance", "public_procurement"],
      "coordinates": { "latitude": 34.0522, "longitude": -118.2437 }
    },
    "event_need": {
      "required_topics": ["artificial_intelligence"],
      "preferred_topics": ["machine_learning"],
      "coordinates": { "latitude": 34.0522, "longitude": -118.2437 }
    }
  },
  "expected": {
    "factor_scores": {
      "topic_relevance": { "value": 0.0, "zero_classification": "measured_zero" },
      "travel_burden": { "value": 0.0, "zero_classification": "measured_zero" }
    },
    "unknown_factor_keys": [],
    "stage_b_score": 0.3
  }
}
